{
  "model_version": "0.1.0",
  "model_family": "inc15d6-govman-2025-dispositions",
  "source_package_id": "GOVMAN-2025-12-31",
  "source_publication_date": "2025-12-31",
  "source_original_sha256": "c1e5b58cce0a018b4995f900584605d07e473079a37d5a665a3a8ebb5d643138",
  "source_original_git_blob_sha1": "195c46a67c87ae85f1dedd423250900f119a041a",
  "source_original_repository_path": "evidence/govman-2025/originals/sha256/c1e5b58cce0a018b4995f900584605d07e473079a37d5a665a3a8ebb5d643138.xml",
  "whole_edition_publisher_entries": 231,
  "existing_provisional_canonical_links": 50,
  "existing_unlinked_source_entries": 181,
  "current_first_level_institution_denominator": null,
  "whole_federal_legal_institution_denominator": null,
  "independent_legal_review_complete": false,
  "independent_worm_custody_verified": false,
  "canonical_component_identities_minted": 0,
  "legally_certified_subordinate_components": 0,
  "observed_command_delegations": 0,
  "new_atlas_relationships": 0,
  "selected_source_entries": 15,
  "dispositions_accounted": 15,
  "commerce_first_level_source_candidates": 10,
  "education_directory_grouping_count": 1,
  "education_affiliated_entries_legal_status_unresolved": 4,
  "prior_noncanonical_research_seeds": 2,
  "prior_exact_named_2026_web_matches_without_original_custody": 8,
  "prior_original_2025_granule_detail_refs": 2,
  "uncertified_alias_name_variants": 1,
  "fiscal_or_command_relation_established": false,
  "education_aided_corporations_are_department_offices": false,
  "items": [
    {
      "id": "INC15D6-DISP-259",
      "source_entity_key": "GOVMAN-2025-12-31:259",
      "publisher_local_id": "259",
      "publisher_edition": "GOVMAN-2025-12-31",
      "published_name": "Bureau of Industry and Security",
      "published_parent_key": "GOVMAN-2025-12-31:113",
      "canonical_department_anchor_id": "ORG-FED-EXE-DEP-COMMERCE",
      "department_publisher_root_key": "GOVMAN-2025-12-31:113",
      "canonical_component_id": null,
      "publisher_hierarchy_level": 1,
      "publisher_element_tag": "SubEntityLevelOne",
      "publisher_sort_order": 1,
      "publisher_original_xpath": "/GovernmentManual/Entity[@EntityId='113']/Childrens/SubEntityLevelOne[@EntityId='259']",
      "source_original_sha256": "c1e5b58cce0a018b4995f900584605d07e473079a37d5a665a3a8ebb5d643138",
      "source_original_git_blob_sha1": "195c46a67c87ae85f1dedd423250900f119a041a",
      "disposition": "source_only_institutional_candidate_pending_statutory_confirmation",
      "disposition_rationale": "Exact-title reference in a separate dated Commerce webpage source model; mutable webpage original bytes and legal identity have not been independently verified.",
      "prior_seed_id": null,
      "prior_exact_2026_commerce_source_unit_id": "DEPT04-UNIT-COMMERCE-BIS",
      "prior_exact_2026_commerce_source_snapshot_id": "DEPT04-SNAPSHOT-COMMERCE",
      "prior_2026_commerce_source_original_bytes_retained": false,
      "prior_govinfo_research_granule_id": null,
      "prior_govinfo_details_page_url": null,
      "unqualified_name_variant_candidate": null,
      "publisher_combined_label_not_split_to_federal_agencies": false,
      "identity_reconciliation_state": "edition_local_source_only_no_legal_canonical_match",
      "publisher_parentage_does_not_establish_legal_supervision": true,
      "affiliated_entries_not_certified_as_US_federal_agencies": true,
      "2026_current_legal_organization_verified": false,
      "specific_legal_identity_certified": false,
      "statutory_delegation_certified": false,
      "budget_or_fiscal_control_certified": false,
      "command_relationship_verified": false,
      "independent_legal_review_complete": false,
      "adl1_certified": false,
      "atlas_graph_admitted": false,
      "plan_or_observatory_inference_created": false
    },
    {
      "id": "INC15D6-DISP-260",
      "source_entity_key": "GOVMAN-2025-12-31:260",
      "publisher_local_id": "260",
      "publisher_edition": "GOVMAN-2025-12-31",
      "published_name": "Economic Development Administration",
      "published_parent_key": "GOVMAN-2025-12-31:113",
      "canonical_department_anchor_id": "ORG-FED-EXE-DEP-COMMERCE",
      "department_publisher_root_key": "GOVMAN-2025-12-31:113",
      "canonical_component_id": null,
      "publisher_hierarchy_level": 1,
      "publisher_element_tag": "SubEntityLevelOne",
      "publisher_sort_order": 2,
      "publisher_original_xpath": "/GovernmentManual/Entity[@EntityId='113']/Childrens/SubEntityLevelOne[@EntityId='260']",
      "source_original_sha256": "c1e5b58cce0a018b4995f900584605d07e473079a37d5a665a3a8ebb5d643138",
      "source_original_git_blob_sha1": "195c46a67c87ae85f1dedd423250900f119a041a",
      "disposition": "source_only_institutional_candidate_pending_statutory_confirmation",
      "disposition_rationale": "Exact-title reference in a separate dated Commerce webpage source model; mutable webpage original bytes and legal identity have not been independently verified.",
      "prior_seed_id": null,
      "prior_exact_2026_commerce_source_unit_id": "DEPT04-UNIT-COMMERCE-EDA",
      "prior_exact_2026_commerce_source_snapshot_id": "DEPT04-SNAPSHOT-COMMERCE",
      "prior_2026_commerce_source_original_bytes_retained": false,
      "prior_govinfo_research_granule_id": null,
      "prior_govinfo_details_page_url": null,
      "unqualified_name_variant_candidate": null,
      "publisher_combined_label_not_split_to_federal_agencies": false,
      "identity_reconciliation_state": "edition_local_source_only_no_legal_canonical_match",
      "publisher_parentage_does_not_establish_legal_supervision": true,
      "affiliated_entries_not_certified_as_US_federal_agencies": true,
      "2026_current_legal_organization_verified": false,
      "specific_legal_identity_certified": false,
      "statutory_delegation_certified": false,
      "budget_or_fiscal_control_certified": false,
      "command_relationship_verified": false,
      "independent_legal_review_complete": false,
      "adl1_certified": false,
      "atlas_graph_admitted": false,
      "plan_or_observatory_inference_created": false
    },
    {
      "id": "INC15D6-DISP-261",
      "source_entity_key": "GOVMAN-2025-12-31:261",
      "publisher_local_id": "261",
      "publisher_edition": "GOVMAN-2025-12-31",
      "published_name": "Economics and Statistics Administration",
      "published_parent_key": "GOVMAN-2025-12-31:113",
      "canonical_department_anchor_id": "ORG-FED-EXE-DEP-COMMERCE",
      "department_publisher_root_key": "GOVMAN-2025-12-31:113",
      "canonical_component_id": null,
      "publisher_hierarchy_level": 1,
      "publisher_element_tag": "SubEntityLevelOne",
      "publisher_sort_order": 3,
      "publisher_original_xpath": "/GovernmentManual/Entity[@EntityId='113']/Childrens/SubEntityLevelOne[@EntityId='261']",
      "source_original_sha256": "c1e5b58cce0a018b4995f900584605d07e473079a37d5a665a3a8ebb5d643138",
      "source_original_git_blob_sha1": "195c46a67c87ae85f1dedd423250900f119a041a",
      "disposition": "source_only_institutional_candidate_pending_statutory_confirmation",
      "disposition_rationale": "2025 Government Manual publisher component lacking an exact-name 2026 Commerce model counterpart; no legal identity or present-day status inferred.",
      "prior_seed_id": null,
      "prior_exact_2026_commerce_source_unit_id": null,
      "prior_exact_2026_commerce_source_snapshot_id": null,
      "prior_2026_commerce_source_original_bytes_retained": false,
      "prior_govinfo_research_granule_id": null,
      "prior_govinfo_details_page_url": null,
      "unqualified_name_variant_candidate": null,
      "publisher_combined_label_not_split_to_federal_agencies": false,
      "identity_reconciliation_state": "edition_local_source_only_no_legal_canonical_match",
      "publisher_parentage_does_not_establish_legal_supervision": true,
      "affiliated_entries_not_certified_as_US_federal_agencies": true,
      "2026_current_legal_organization_verified": false,
      "specific_legal_identity_certified": false,
      "statutory_delegation_certified": false,
      "budget_or_fiscal_control_certified": false,
      "command_relationship_verified": false,
      "independent_legal_review_complete": false,
      "adl1_certified": false,
      "atlas_graph_admitted": false,
      "plan_or_observatory_inference_created": false
    },
    {
      "id": "INC15D6-DISP-262",
      "source_entity_key": "GOVMAN-2025-12-31:262",
      "publisher_local_id": "262",
      "publisher_edition": "GOVMAN-2025-12-31",
      "published_name": "International Trade Administration",
      "published_parent_key": "GOVMAN-2025-12-31:113",
      "canonical_department_anchor_id": "ORG-FED-EXE-DEP-COMMERCE",
      "department_publisher_root_key": "GOVMAN-2025-12-31:113",
      "canonical_component_id": null,
      "publisher_hierarchy_level": 1,
      "publisher_element_tag": "SubEntityLevelOne",
      "publisher_sort_order": 4,
      "publisher_original_xpath": "/GovernmentManual/Entity[@EntityId='113']/Childrens/SubEntityLevelOne[@EntityId='262']",
      "source_original_sha256": "c1e5b58cce0a018b4995f900584605d07e473079a37d5a665a3a8ebb5d643138",
      "source_original_git_blob_sha1": "195c46a67c87ae85f1dedd423250900f119a041a",
      "disposition": "source_only_institutional_candidate_pending_statutory_confirmation",
      "disposition_rationale": "Exact-title reference in a separate dated Commerce webpage source model; mutable webpage original bytes and legal identity have not been independently verified.",
      "prior_seed_id": null,
      "prior_exact_2026_commerce_source_unit_id": "DEPT04-UNIT-COMMERCE-ITA",
      "prior_exact_2026_commerce_source_snapshot_id": "DEPT04-SNAPSHOT-COMMERCE",
      "prior_2026_commerce_source_original_bytes_retained": false,
      "prior_govinfo_research_granule_id": null,
      "prior_govinfo_details_page_url": null,
      "unqualified_name_variant_candidate": null,